### ISSUE TITLE
Making too many connections

### ISSUE THREAD

**Issue by Ragsboss** [arista-eosplus/pyeapi#168]
We are using `pyeapi==0.8.2` to connect remotely to an EOS box. What we are observing is the TCP connection keeps getting recreated for every call to `execute` method.

```
04:55:50.675840 IP 10.142.165.183.35167 > 172.20.161.151.http: Flags [S], seq 434414532, win 29200, options [mss 1460,nop,nop,sackOK,nop,wscale 7], length 0
04:55:50.676744 IP 172.20.161.151.http > 10.142.165.183.35167: Flags [S.], seq 2960340659, ack 434414533, win 14600, options [mss 1460,nop,nop,sackOK,nop,wscale 7], length 0
04:55:50.676780 IP 10.142.165.183.35167 > 172.20.161.151.http: Flags [.], ack 1, win 229, length 0
04:55:50.676837 IP 10.142.165.183.35167 > 172.20.161.151.http: Flags [P.], seq 1:328, ack 1, win 229, length 327: HTTP: POST /command-api HTTP/1.1
04:55:50.678222 IP 172.20.161.151.http > 10.142.165.183.35167: Flags [.], ack 328, win 123, length 0
04:55:50.988145 IP 172.20.161.151.http > 10.142.165.183.35167: Flags [.], seq 1:11681, ack 328, win 123, length 11680: HTTP: HTTP/1.1 200 OK
04:55:50.988214 IP 10.142.165.183.35167 > 172.20.161.151.http: Flags [.], ack 11681, win 411, length 0
04:56:10.956572 IP 172.20.161.151.http > 10.142.165.183.35173: Flags [.], seq 604697995:604703835, ack 3553664234, win 123, length 5840: HTTP: HTTP/1.1 200 OK
04:56:10.956626 IP 10.142.165.183.35173 > 172.20.161.151.http: Flags [.], ack 5840, win 320, length 0
04:56:10.956688 IP 172.20.161.151.http > 10.142.165.183.35173: Flags [.], seq 5840:14600, ack 1, win 123, length 8760: HTTP
04:56:10.956720 IP 10.142.165.183.35173 > 172.20.161.151.http: Flags [.], ack 14600, win 457, length 0
04:56:10.957409 IP 172.20.161.151.http > 10.142.165.183.35173: Flags [.], seq 14600:16060, ack 1, win 123, length 1460: HTTP
04:56:10.957443 IP 10.142.165.183.35173 > 172.20.161.151.http: Flags [.], ack 16060, win 480, length 0
04:56:10.957520 IP 172.20.161.151.http > 10.142.165.183.35173: Flags [P.], seq 16060:18209, ack 1, win 123, length 2149: HTTP
04:56:10.957559 IP 10.142.165.183.35173 > 172.20.161.151.http: Flags [.], ack 18209, win 513, length 0
04:56:10.958843 IP 10.142.165.183.35173 > 172.20.161.151.http: Flags [F.], seq 1, ack 18209, win 513, length 0
04:56:10.959613 IP 172.20.161.151.http > 10.142.165.183.35173: Flags [F.], seq 18209, ack 2, win 123, length 0
04:56:10.959660 IP 10.142.165.183.35173 > 172.20.161.151.http: Flags [.], ack 18210, win 513, length 0
04:56:20.678752 IP 10.142.165.183.35176 > 172.20.161.151.http: Flags [S], seq 3294617702, win 29200, options [mss 1460,nop,nop,sackOK,nop,wscale 7], length 0
04:56:20.679661 IP 172.20.161.151.http > 10.142.165.183.35176: Flags [S.], seq 1960583688, ack 3294617703, win 14600, options [mss 1460,nop,nop,sackOK,nop,wscale 7], length 0
04:56:20.679734 IP 10.142.165.183.35176 > 172.20.161.151.http: Flags [.], ack 1, win 229, length 0
04:56:20.679807 IP 10.142.165.183.35176 > 172.20.161.151.http: Flags [P.], seq 1:328, ack 1, win 229, length 327: HTTP: POST /command-api HTTP/1.1
04:56:20.681168 IP 172.20.161.151.http > 10.142.165.183.35176: Flags [.], ack 328, win 123, length 0
04:56:20.980432 IP 172.20.161.151.http > 10.142.165.183.35176: Flags [.], seq 1:4381, ack 328, win 123, length 4380: HTTP: HTTP/1.1 200 OK
04:56:20.980528 IP 10.142.165.183.35176 > 172.20.161.151.http: Flags [.], ack 4381, win 297, length 0
04:56:20.980586 IP 172.20.161.151.http > 10.142.165.183.35176: Flags [.], seq 4381:14601, ack 328, win 123, length 10220: HTTP
04:56:20.980610 IP 10.142.165.183.35176 > 172.20.161.151.http: Flags [.], ack 14601, win 457, length 0
04:56:20.981172 IP 172.20.161.151.http > 10.142.165.183.35176: Flags [.], seq 14601:16061, ack 328, win 123, length 1460: HTTP
04:56:20.981200 IP 10.142.165.183.35176 > 172.20.161.151.http: Flags [.], ack 16061, win 480, length 0
04:56:20.981276 IP 172.20.161.151.http > 10.142.165.183.35176: Flags [P.], seq 16061:18206, ack 328, win 123, length 2145: HTTP
```

Any help is greatly appreciated. Our sample code is
```
self. eapi = pyeapi.connect(
                transport=self.proto, host=self.hostname,
                username=self.user, password=self.passwd, port=self.port)
...
got = self.eapi.execute(commands=commands, encoding=encoding)
```
